<?xml version="1.0" encoding="UTF-8"?>
<xs:schema xmlns:xs="http://www.w3.org/2001/XMLSchema"
           elementFormDefault="qualified">

  <!-- Root element for a single prompt -->
  <xs:element name="prompt">
    <xs:complexType>
      <xs:sequence>
        <xs:element name="role" type="xs:string"/>
        <xs:element name="task" type="xs:string"/>
        <xs:element name="context" type="xs:string" minOccurs="0"/>
        <xs:element name="data" type="xs:string" minOccurs="0"/>
        <xs:element name="examples" type="xs:string" minOccurs="0"/>
        <xs:element name="constraints" type="xs:string" minOccurs="0"/>
        <xs:element name="format" type="xs:string" minOccurs="0"/>
      </xs:sequence>
    </xs:complexType>
  </xs:element>

</xs:schema>